{
  "sail_version": "0.1",
  "message_id": "sail-msg-0003",
  "message_type": "MANEUVER_INTENT",
  "created_at": "2026-05-12T15:05:00Z",
  "valid_until": "2026-05-12T15:50:00Z",
  "operator_id": "ExampleSatCo",
  "constellation_id": "ExampleNet-A",
  "object_id": "NORAD-90001",
  "counterparty_object_id": "NORAD-91007",
  "coordination_context": {
    "context_type": "conjunction",
    "urgency": "urgent",
    "related_event_id": "CDM-EXAMPLE-20260512-01",
    "coordination_channel": "operator_to_operator"
  },
  "payload": {
    "maneuver_id": "MAN-90001-20260512-01",
    "purpose": "collision_avoidance",
    "intent_status": "planned",
    "decision_mode": "autonomous",
    "maneuver_window": {
      "start": "2026-05-12T15:36:00Z",
      "end": "2026-05-12T15:41:00Z"
    },
    "expected_post_maneuver_state": {
      "format": "CCSDS_OCM",
      "reference": "examples/orbits/example-satco-90001-post-maneuver.ocm.json",
      "epoch": "2026-05-12T15:45:00Z",
      "uncertainty": {
        "representation": "covariance",
        "confidence": 0.95,
        "source": "maneuver_planning_system"
      }
    },
    "uncertainty": {
      "representation": "covariance",
      "confidence": 0.95,
      "source": "operator_navigation_solution"
    },
    "coordination_status": "claiming_responsibility"
  },
  "audit": {
    "input_data_sources": [
      "CDM-EXAMPLE-20260512-01",
      "operator_navigation_solution",
      "counterparty_state_update"
    ],
    "risk_threshold_class": "mitigate",
    "decision_mode": "autonomous",
    "software_version": "ExampleSatCo-COLA-3.4.1",
    "communications_status": "nominal",
    "override_status": "none",
    "result_status": "pending"
  }
}
