{
  "sail_version": "0.1",
  "message_id": "sail-msg-0001",
  "message_type": "STATE_UPDATE",
  "created_at": "2026-05-12T15:00:00Z",
  "valid_until": "2026-05-12T15:15:00Z",
  "operator_id": "ExampleSatCo",
  "constellation_id": "ExampleNet-A",
  "object_id": "NORAD-90001",
  "coordination_context": {
    "context_type": "nominal",
    "urgency": "routine",
    "coordination_channel": "test_simulation"
  },
  "payload": {
    "autonomy_mode": "autonomous",
    "maneuverability": "available",
    "propulsion_margin": "nominal",
    "communications_status": "nominal",
    "degraded_flags": [],
    "orbit": {
      "format": "CCSDS_OMM",
      "reference": "examples/orbits/example-satco-90001.omm.json",
      "epoch": "2026-05-12T15:00:00Z",
      "uncertainty": {
        "representation": "covariance",
        "confidence": 0.95,
        "source": "operator_navigation_solution"
      }
    }
  }
}
